{
  "bundle_schema_version": "1.0",
  "release_id": "npi-20260712-fixture-v1",
  "generated_at": "2026-07-12T00:00:00Z",
  "producer": {
    "project": "nightly-photo-intelligence-pipeline",
    "code_commit": "0000000"
  },
  "target": {
    "consumer": "ai-photography-director-app",
    "contract": "PHOTO_INTELLIGENCE_BUNDLE_V1"
  },
  "item_count": 1,
  "items": [
    {
      "asset_id": "npi_fixture_asset_001",
      "item_path": "items/npi_fixture_asset_001.json",
      "sha256": "d9bb9f2cb9744818bf55ce0249074324f40655d344f7d7d2fcac7dcceaeebec2",
      "review_status": "APPROVED"
    }
  ],
  "assets": [],
  "review_summary": {
    "approved": 1,
    "rejected": 0,
    "excluded_not_approved": 0
  },
  "integrity": {
    "checksums_file": "CHECKSUMS.sha256",
    "algorithm": "SHA-256",
    "scope": "ALL_RELEASE_FILES_EXCEPT_CHECKSUMS_FILE"
  },
  "provenance": {
    "schema_set": "npi-bundle-v1.0",
    "release_config_sha256": "cccccccccccccccccccccccccccccccccccccccccccccccccccccccccccccccc"
  }
}
